{
  "$schema": "../../../claudinite-tasks/task.schema.json",
  "id": "ci-performance",
  "description": "Reads where this repository's CI time goes from the Actions run history, keeps a standing record of each workflow's median, and hands an agent a real regression already localised to a workflow and a before-and-after delta.",
  "trigger": "schedule",
  "preconditions": [
    "due:weekly",
    "substantive-change || prs-touched",
    "no-open-pr-of-this-task"
  ],
  "expected_outcome": "fresh_pr",
  "automerge": "anything",
  "code_work": "node worker.mjs",
  "code_work_timeout": 300,
  "agent_model": "sonnet",
  "agent_instructions": "task.md",
  "agent_execution_timeout": 3600
}
