{
  "$schema": "../../../claudinite-tasks/task.schema.json",
  "id": "growth-discover-packs",
  "description": "The fleet sweep for technologies the canon's shelf does not yet home: reads what every member is built on, subtracts what the shelf covers, and opens a reviewed pull request authoring the missing pack. The only stage anywhere that mints a pack.",
  "trigger": "schedule",
  "preconditions": [
    "schedule:at-most-weekly"
  ],
  "expected_outcome": "fresh_pr",
  "automerge": "nothing",
  "invocation_endpoint": "fleet",
  "agent_model": "opus",
  "agent_instructions": "task.md",
  "agent_execution_timeout": 3600
}
