{
  "$schema": "../../../claudinite-tasks/task.schema.json",
  "id": "usage-triage",
  "description": "Turns a usage-review finding that has stood two weeks into a proposed change to this repo's own local packs — the edit itself, one pull request per subject, for the owner to merge or decline.",
  "trigger": "schedule",
  "preconditions": [
    "schedule:at-most-weekly",
    "lasting-usage-finding"
  ],
  "expected_outcome": "fresh_pr",
  "automerge": "nothing",
  "agent_model": "opus",
  "agent_instructions": "task.md",
  "agent_execution_timeout": 2700
}
