{
  "$schema": "../../../claudinite-tasks/task.schema.json",
  "id": "update",
  "description": "Maintains this repository's Claudinite mount: converges the vendored engine and packs to the canon's versions, runs the version-ranged migrations, gates on the self-test and opens the update pull request. An agent runs where the new rules meet member-authored content, and where the converge wrote what this repo's tests can see.",
  "trigger": "schedule",
  "preconditions": [
    "due:daily"
  ],
  "expected_outcome": "supersede_existing_pr",
  "automerge": [
    "claudinite-shared-packs",
    "under:.claudinite",
    "claudinite-settings-updates",
    "under:.github/workflows",
    "test-changes"
  ],
  "code_work": "node worker.mjs",
  "code_work_timeout": 900,
  "agent_model": "sonnet",
  "agent_instructions": "task.md",
  "agent_execution_timeout": 1800
}
